{
  "schemaVersion": "ruleoak.policy_pack.v1",
  "id": "ticketing-readonly",
  "name": "Ticketing Read-only Evidence",
  "version": "1.0.0",
  "category": "ticketing",
  "description": "Allows read-only ticket evidence collection and blocks ticket mutations.",
  "compatibility": {
    "policyPackSchema": "ruleoak.policy_pack.v1",
    "governanceProtocol": "ruleoak.governance.v1",
    "latestPublicCoreRelease": "v2.2.0",
    "earlierPublicBaseline": "v1.0.1",
    "developmentTrack": "RuleOak Core v2.2.0 release",
    "supportsCoreMajor": [
      "2",
      "future-3"
    ]
  },
  "policy": {
    "allowedTools": [
      "read_ticket",
      "search_tickets",
      "collect_ticket_evidence"
    ],
    "approvalRequired": [],
    "blockedTools": [
      "comment_ticket",
      "transition_ticket",
      "close_ticket",
      "assign_ticket"
    ],
    "boundary": "read_only"
  },
  "scenarioTests": [
    {
      "id": "ticketing-readonly-default-scenario",
      "title": "Ticketing Read-only Evidence default scenario",
      "description": "Pack-local scenario used by RuleOak Policy Pack Maturity checks. It evaluates declared allow, approval, and deny decisions without executing tools.",
      "calls": [
        {
          "toolId": "read_ticket",
          "subject": "ticketing-readonly scenario: read_ticket",
          "expectedDecision": "allowed"
        },
        {
          "toolId": "search_tickets",
          "subject": "ticketing-readonly scenario: search_tickets",
          "expectedDecision": "allowed"
        },
        {
          "toolId": "collect_ticket_evidence",
          "subject": "ticketing-readonly scenario: collect_ticket_evidence",
          "expectedDecision": "allowed"
        },
        {
          "toolId": "comment_ticket",
          "subject": "ticketing-readonly scenario: comment_ticket",
          "expectedDecision": "blocked"
        },
        {
          "toolId": "transition_ticket",
          "subject": "ticketing-readonly scenario: transition_ticket",
          "expectedDecision": "blocked"
        },
        {
          "toolId": "close_ticket",
          "subject": "ticketing-readonly scenario: close_ticket",
          "expectedDecision": "blocked"
        }
      ]
    }
  ],
  "tools": [],
  "metadata": {
    "maturity": "reference-pack",
    "owner": "RuleOak maintainers",
    "status": "public-release",
    "publicCoreBaseline": "v2.2.0"
  }
}
