{
  "schemaVersion": "ruleoak.policy_pack.v1",
  "id": "ticketing-write-approval",
  "name": "Ticketing Write Approval",
  "version": "1.0.0",
  "category": "ticketing",
  "description": "Allows ticket reads and requires approval for comments, transitions, and assignment changes.",
  "compatibility": {
    "policyPackSchema": "ruleoak.policy_pack.v1",
    "governanceProtocol": "ruleoak.governance.v1",
    "latestPublicCoreRelease": "v2.2.0",
    "earlierPublicBaseline": "v1.0.1",
    "developmentTrack": "RuleOak Core v2.2.0 release",
    "supportsCoreMajor": [
      "2",
      "future-3"
    ]
  },
  "policy": {
    "allowedTools": [
      "read_ticket",
      "search_tickets",
      "collect_ticket_evidence"
    ],
    "approvalRequired": [
      "comment_ticket",
      "transition_ticket",
      "assign_ticket"
    ],
    "blockedTools": [
      "delete_ticket",
      "bulk_close_tickets"
    ],
    "boundary": "approval_gated_writes"
  },
  "scenarioTests": [
    {
      "id": "ticketing-write-approval-default-scenario",
      "title": "Ticketing Write Approval default scenario",
      "description": "Pack-local scenario used by RuleOak Policy Pack Maturity checks. It evaluates declared allow, approval, and deny decisions without executing tools.",
      "calls": [
        {
          "toolId": "read_ticket",
          "subject": "ticketing-write-approval scenario: read_ticket",
          "expectedDecision": "allowed"
        },
        {
          "toolId": "search_tickets",
          "subject": "ticketing-write-approval scenario: search_tickets",
          "expectedDecision": "allowed"
        },
        {
          "toolId": "collect_ticket_evidence",
          "subject": "ticketing-write-approval scenario: collect_ticket_evidence",
          "expectedDecision": "allowed"
        },
        {
          "toolId": "comment_ticket",
          "subject": "ticketing-write-approval scenario: comment_ticket",
          "expectedDecision": "approval_required"
        },
        {
          "toolId": "transition_ticket",
          "subject": "ticketing-write-approval scenario: transition_ticket",
          "expectedDecision": "approval_required"
        },
        {
          "toolId": "assign_ticket",
          "subject": "ticketing-write-approval scenario: assign_ticket",
          "expectedDecision": "approval_required"
        },
        {
          "toolId": "delete_ticket",
          "subject": "ticketing-write-approval scenario: delete_ticket",
          "expectedDecision": "blocked"
        },
        {
          "toolId": "bulk_close_tickets",
          "subject": "ticketing-write-approval scenario: bulk_close_tickets",
          "expectedDecision": "blocked"
        }
      ]
    }
  ],
  "tools": [],
  "metadata": {
    "maturity": "reference-pack",
    "owner": "RuleOak maintainers",
    "status": "public-release",
    "publicCoreBaseline": "v2.2.0"
  }
}
