{
  "schemaVersion": "ruleoak.policy_pack.v1",
  "id": "personal-local-assistant-governance",
  "name": "Personal Local-First Assistant Governance",
  "version": "1.0.0",
  "category": "personal",
  "description": "Govern local-first personal assistant reads, drafts, external sends, and private-file upload attempts.",
  "compatibility": {
    "policyPackSchema": "ruleoak.policy_pack.v1",
    "governanceProtocol": "ruleoak.governance.v1",
    "latestPublicCoreRelease": "v2.2.0",
    "earlierPublicBaseline": "v1.0.1",
    "developmentTrack": "RuleOak Core v2.2.0 release",
    "supportsCoreMajor": [
      "2",
      "future-3"
    ]
  },
  "policy": {
    "boundary": "local_first_personal_assistant_external_action_boundary",
    "allowedTools": [
      "read.user_intent",
      "read.local_note_index",
      "read.local_note",
      "read.calendar_summary",
      "draft.email",
      "scan.private_data",
      "read.external_action_policy",
      "generate.local_report"
    ],
    "approvalRequired": [
      "send.email",
      "create.calendar_event",
      "modify.local_file",
      "run.local_command"
    ],
    "blockedTools": [
      "upload.private_files",
      "delete.photo_library",
      "send.without_review",
      "expose.secrets"
    ]
  },
  "scenarioTests": [
    {
      "id": "personal-local-assistant-governance-default-scenario",
      "title": "Personal Local-First Assistant Governance default scenario",
      "description": "Pack-local scenario used by RuleOak Policy Pack Maturity checks. It evaluates declared allow, approval, and deny decisions without executing tools.",
      "calls": [
        {
          "toolId": "read.user_intent",
          "subject": "personal-local-assistant-governance scenario: read.user_intent",
          "expectedDecision": "allowed"
        },
        {
          "toolId": "read.local_note_index",
          "subject": "personal-local-assistant-governance scenario: read.local_note_index",
          "expectedDecision": "allowed"
        },
        {
          "toolId": "read.local_note",
          "subject": "personal-local-assistant-governance scenario: read.local_note",
          "expectedDecision": "allowed"
        },
        {
          "toolId": "send.email",
          "subject": "personal-local-assistant-governance scenario: send.email",
          "expectedDecision": "approval_required"
        },
        {
          "toolId": "create.calendar_event",
          "subject": "personal-local-assistant-governance scenario: create.calendar_event",
          "expectedDecision": "approval_required"
        },
        {
          "toolId": "modify.local_file",
          "subject": "personal-local-assistant-governance scenario: modify.local_file",
          "expectedDecision": "approval_required"
        },
        {
          "toolId": "upload.private_files",
          "subject": "personal-local-assistant-governance scenario: upload.private_files",
          "expectedDecision": "blocked"
        },
        {
          "toolId": "delete.photo_library",
          "subject": "personal-local-assistant-governance scenario: delete.photo_library",
          "expectedDecision": "blocked"
        },
        {
          "toolId": "send.without_review",
          "subject": "personal-local-assistant-governance scenario: send.without_review",
          "expectedDecision": "blocked"
        }
      ]
    }
  ],
  "tools": [
    {
      "id": "read.user_intent",
      "risk": "low"
    },
    {
      "id": "read.local_note_index",
      "risk": "low"
    },
    {
      "id": "read.local_note",
      "risk": "low"
    },
    {
      "id": "send.email",
      "risk": "high"
    },
    {
      "id": "create.calendar_event",
      "risk": "high"
    },
    {
      "id": "upload.private_files",
      "risk": "critical"
    },
    {
      "id": "delete.photo_library",
      "risk": "critical"
    }
  ],
  "metadata": {
    "requiredEvidence": [
      "user intent",
      "local note index",
      "local note",
      "calendar summary",
      "draft",
      "privacy scan",
      "external action policy"
    ],
    "examples": [
      "examples/personal-local-first-assistant-governance"
    ],
    "maturity": "reference-vertical",
    "owner": "RuleOak maintainers",
    "status": "public-release",
    "publicCoreBaseline": "v2.2.0"
  }
}
